{
  "$schema": "https://json-schema.org/draft/2020-12/schema",
  "$id": "#/components/schemas/InstanceSummary",
  "title": "InstanceSummary",
  "type": "object",
  "description": "Information about the Amazon Connect instance.",
  "properties": {
    "Id": {
      "type": "string",
      "description": "The identifier of the instance.",
      "example": "a1b2c3d4-5678-90ab-cdef-11111EXAMPLE"
    },
    "Arn": {
      "type": "string",
      "description": "The ARN of the instance.",
      "example": "arn:aws:connect:us-east-1:123456789012:instance/a1b2c3d4-5678-90ab-cdef-11111EXAMPLE"
    },
    "IdentityManagementType": {
      "type": "string",
      "description": "The identity management type.",
      "example": "CONNECT_MANAGED"
    },
    "InstanceAlias": {
      "type": "string",
      "description": "The alias of the instance.",
      "example": "my-contact-center"
    },
    "InstanceStatus": {
      "type": "string",
      "description": "The state of the instance.",
      "example": "ACTIVE"
    },
    "InboundCallsEnabled": {
      "type": "boolean",
      "example": true
    },
    "OutboundCallsEnabled": {
      "type": "boolean",
      "example": true
    }
  }
}